2018-07-24 18:46:03.467097 IP 172.17.0.2.8000 > 172.17.0.1.37436: Flags [P.], seq 1146027412:1146027982, ack 1274675995, win 235, options [nop,nop,TS val 2247612 ecr 2247578], length 570
2018-07-24 18:46:03.467264 IP 172.17.0.2.8000 > 172.17.0.1.36866: Flags [P.], seq 2726929042:2726931422, ack 3983119563, win 235, options [nop,nop,TS val 2247612 ecr 2247578], length 2380
2018-07-24 18:46:03.467990 IP 172.17.0.2.8000 > 172.17.0.1.37436: Flags [P.], seq 1146027982:1146027983, ack 1274675995, win 235, options [nop,nop,TS val 2247612 ecr 2247612], length 1
2018-07-24 18:46:03.468439 IP 172.17.0.2.8000 > 172.17.0.1.37436: Flags [P.], seq 1146027983:1146029793, ack 1274675995, win 235, options [nop,nop,TS val 2247612 ecr 2247612], length 1810
2018-07-24 18:46:03.807415 IP 172.17.0.2.8000 > 172.17.0.1.37436: Flags [P.], seq 1146029793:1146032180, ack 1274675995, win 235, options [nop,nop,TS val 2247646 ecr 2247612], length 2387
2018-07-24 18:46:03.807559 IP 172.17.0.2.8000 > 172.17.0.1.36866: Flags [P.], seq 2726931422:2726933809, ack 3983119563, win 235, options [nop,nop,TS val 2247646 ecr 2247612], length 2387
2018-07-24 18:46:04.146597 IP 172.17.0.2.8000 > 172.17.0.1.37436: Flags [P.], seq 1146032180:1146034553, ack 1274675995, win 235, options [nop,nop,TS val 2247680 ecr 2247646], length 2373
2018-07-24 18:46:04.146674 IP 172.17.0.2.8000 > 172.17.0.1.36866: Flags [P.], seq 2726933809:2726936182, ack 3983119563, win 235, options [nop,nop,TS val 2247680 ecr 2247646], length 2373
2018-07-24 18:46:04.485651 IP 172.17.0.2.8000 > 172.17.0.1.37436: Flags [P.], seq 1146034553:1146036175, ack 1274675995, win 235, options [nop,nop,TS val 2247714 ecr 2247680], length 1622
2018-07-24 18:46:04.485731 IP 172.17.0.2.8000 > 172.17.0.1.36866: Flags [P.], seq 2726936182:2726938555, ack 3983119563, win 235, options [nop,nop,TS val 2247714 ecr 2247680], length 2373
2018-07-24 18:46:04.485766 IP 172.17.0.2.8000 > 172.17.0.1.37436: Flags [P.], seq 1146036175:1146036176, ack 1274675995, win 235, options [nop,nop,TS val 2247714 ecr 2247714], length 1
2018-07-24 18:46:04.485784 IP 172.17.0.2.8000 > 172.17.0.1.37436: Flags [P.], seq 1146036176:1146036927, ack 1274675995, win 235, options [nop,nop,TS val 2247714 ecr 2247714], length 751
2018-07-24 18:46:04.826692 IP 172.17.0.2.8000 > 172.17.0.1.37436: Flags [P.], seq 1146036927:1146039314, ack 1274675995, win 235, options [nop,nop,TS val 2247748 ecr 2247714], length 2387
2018-07-24 18:46:04.826770 IP 172.17.0.2.8000 > 172.17.0.1.36866: Flags [P.], seq 2726938555:2726940942, ack 3983119563, win 235, options [nop,nop,TS val 2247748 ecr 2247714], length 2387
2018-07-24 18:46:05.166895 IP 172.17.0.2.8000 > 172.17.0.1.37436: Flags [P.], seq 1146039314:1146041694, ack 1274675995, win 235, options [nop,nop,TS val 2247782 ecr 2247748], length 2380
2018-07-24 18:46:05.166980 IP 172.17.0.2.8000 > 172.17.0.1.36866: Flags [P.], seq 2726940942:2726943322, ack 3983119563, win 235, options [nop,nop,TS val 2247782 ecr 2247748], length 2380
2018-07-24 18:46:05.507914 IP 172.17.0.2.8000 > 172.17.0.1.37436: Flags [P.], seq 1146041694:1146044081, ack 1274675995, win 235, options [nop,nop,TS val 2247816 ecr 2247782], length 2387
2018-07-24 18:46:05.508134 IP 172.17.0.2.8000 > 172.17.0.1.36866: Flags [P.], seq 2726943322:2726945709, ack 3983119563, win 235, options [nop,nop,TS val 2247816 ecr 2247782], length 2387
2018-07-24 18:46:05.849209 IP 172.17.0.2.8000 > 172.17.0.1.37436: Flags [P.], seq 1146044081:1146044368, ack 1274675995, win 235, options [nop,nop,TS val 2247851 ecr 2247816], length 287
2018-07-24 18:46:05.849705 IP 172.17.0.2.8000 > 172.17.0.1.36866: Flags [P.], seq 2726945709:2726948096, ack 3983119563, win 235, options [nop,nop,TS val 2247851 ecr 2247816], length 2387
2018-07-24 18:46:05.850903 IP 172.17.0.2.8000 > 172.17.0.1.37436: Flags [P.], seq 1146044368:1146044369, ack 1274675995, win 235, options [nop,nop,TS val 2247851 ecr 2247851], length 1
2018-07-24 18:46:05.851267 IP 172.17.0.2.8000 > 172.17.0.1.37436: Flags [P.], seq 1146044369:1146046469, ack 1274675995, win 235, options [nop,nop,TS val 2247851 ecr 2247851], length 2100
2018-07-24 18:46:06.187880 IP 172.17.0.2.8000 > 172.17.0.1.37436: Flags [P.], seq 1146046469:1146048842, ack 1274675995, win 235, options [nop,nop,TS val 2247884 ecr 2247851], length 2373
2018-07-24 18:46:06.188059 IP 172.17.0.2.8000 > 172.17.0.1.36866: Flags [P.], seq 2726948096:2726950469, ack 3983119563, win 235, options [nop,nop,TS val 2247884 ecr 2247851], length 2373
2018-07-24 18:46:06.526540 IP 172.17.0.2.8000 > 172.17.0.1.37436: Flags [P.], seq 1146048842:1146051215, ack 1274675995, win 235, options [nop,nop,TS val 2247918 ecr 2247884], length 2373
2018-07-24 18:46:06.526697 IP 172.17.0.2.8000 > 172.17.0.1.36866: Flags [P.], seq 2726950469:2726952842, ack 3983119563, win 235, options [nop,nop,TS val 2247918 ecr 2247884], length 2373
2018-07-24 18:46:06.867497 IP 172.17.0.2.8000 > 172.17.0.1.37436: Flags [P.], seq 1146051215:1146052561, ack 1274675995, win 235, options [nop,nop,TS val 2247952 ecr 2247918], length 1346
2018-07-24 18:46:06.867812 IP 172.17.0.2.8000 > 172.17.0.1.36866: Flags [P.], seq 2726952842:2726955229, ack 3983119563, win 235, options [nop,nop,TS val 2247952 ecr 2247918], length 2387
2018-07-24 18:46:06.868420 IP 172.17.0.2.8000 > 172.17.0.1.37436: Flags [P.], seq 1146052561:1146052562, ack 1274675995, win 235, options [nop,nop,TS val 2247952 ecr 2247952], length 1
2018-07-24 18:46:06.868561 IP 172.17.0.2.8000 > 172.17.0.1.37436: Flags [P.], seq 1146052562:1146053603, ack 1274675995, win 235, options [nop,nop,TS val 2247952 ecr 2247952], length 1041
2018-07-24 18:46:07.208398 IP 172.17.0.2.8000 > 172.17.0.1.37436: Flags [P.], seq 1146053603:1146055990, ack 1274675995, win 235, options [nop,nop,TS val 2247986 ecr 2247952], length 2387
2018-07-24 18:46:07.208574 IP 172.17.0.2.8000 > 172.17.0.1.36866: Flags [P.], seq 2726955229:2726957616, ack 3983119563, win 235, options [nop,nop,TS val 2247986 ecr 2247952], length 2387
2018-07-24 18:46:07.547757 IP 172.17.0.2.8000 > 172.17.0.1.37436: Flags [P.], seq 1146055990:1146058363, ack 1274675995, win 235, options [nop,nop,TS val 2248020 ecr 2247986], length 2373
2018-07-24 18:46:07.547977 IP 172.17.0.2.8000 > 172.17.0.1.36866: Flags [P.], seq 2726957616:2726959989, ack 3983119563, win 235, options [nop,nop,TS val 2248020 ecr 2247986], length 2373
2018-07-24 18:46:07.887610 IP 172.17.0.2.8000 > 172.17.0.1.37436: Flags [P.], seq 1146058363:1146060743, ack 1274675995, win 235, options [nop,nop,TS val 2248054 ecr 2248020], length 2380
2018-07-24 18:46:07.887860 IP 172.17.0.2.8000 > 172.17.0.1.36866: Flags [P.], seq 2726959989:2726962369, ack 3983119563, win 235, options [nop,nop,TS val 2248054 ecr 2248020], length 2380
2018-07-24 18:46:08.228880 IP 172.17.0.2.8000 > 172.17.0.1.37436: Flags [P.], seq 1146060743:1146060754, ack 1274675995, win 235, options [nop,nop,TS val 2248088 ecr 2248054], length 11
2018-07-24 18:46:08.229242 IP 172.17.0.2.8000 > 172.17.0.1.36866: Flags [P.], seq 2726962369:2726964756, ack 3983119563, win 235, options [nop,nop,TS val 2248089 ecr 2248054], length 2387
2018-07-24 18:46:08.229927 IP 172.17.0.2.8000 > 172.17.0.1.37436: Flags [P.], seq 1146060754:1146060755, ack 1274675995, win 235, options [nop,nop,TS val 2248089 ecr 2248088], length 1
2018-07-24 18:46:08.230314 IP 172.17.0.2.8000 > 172.17.0.1.37436: Flags [P.], seq 1146060755:1146063131, ack 1274675995, win 235, options [nop,nop,TS val 2248089 ecr 2248089], length 2376
2018-07-24 18:46:08.567691 IP 172.17.0.2.8000 > 172.17.0.1.37436: Flags [P.], seq 1146063131:1146065504, ack 1274675995, win 235, options [nop,nop,TS val 2248122 ecr 2248089], length 2373
2018-07-24 18:46:08.567922 IP 172.17.0.2.8000 > 172.17.0.1.36866: Flags [P.], seq 2726964756:2726967129, ack 3983119563, win 235, options [nop,nop,TS val 2248122 ecr 2248089], length 2373
2018-07-24 18:46:08.908341 IP 172.17.0.2.8000 > 172.17.0.1.37436: Flags [P.], seq 1146065504:1146067891, ack 1274675995, win 235, options [nop,nop,TS val 2248156 ecr 2248122], length 2387
2018-07-24 18:46:08.908482 IP 172.17.0.2.8000 > 172.17.0.1.36866: Flags [P.], seq 2726967129:2726969516, ack 3983119563, win 235, options [nop,nop,TS val 2248156 ecr 2248122], length 2387
2018-07-24 18:46:09.249419 IP 172.17.0.2.8000 > 172.17.0.1.37436: Flags [P.], seq 1146067891:1146068947, ack 1274675995, win 235, options [nop,nop,TS val 2248191 ecr 2248156], length 1056
2018-07-24 18:46:09.249955 IP 172.17.0.2.8000 > 172.17.0.1.36866: Flags [P.], seq 2726969516:2726971903, ack 3983119563, win 235, options [nop,nop,TS val 2248191 ecr 2248156], length 2387
2018-07-24 18:46:09.250450 IP 172.17.0.2.8000 > 172.17.0.1.37436: Flags [P.], seq 1146068947:1146068948, ack 1274675995, win 235, options [nop,nop,TS val 2248191 ecr 2248191], length 1
2018-07-24 18:46:09.251032 IP 172.17.0.2.8000 > 172.17.0.1.37436: Flags [P.], seq 1146068948:1146070279, ack 1274675995, win 235, options [nop,nop,TS val 2248191 ecr 2248191], length 1331
2018-07-24 18:46:09.588742 IP 172.17.0.2.8000 > 172.17.0.1.37436: Flags [P.], seq 1146070279:1146072652, ack 1274675995, win 235, options [nop,nop,TS val 2248224 ecr 2248191], length 2373
2018-07-24 18:46:09.589123 IP 172.17.0.2.8000 > 172.17.0.1.36866: Flags [P.], seq 2726971903:2726974276, ack 3983119563, win 235, options [nop,nop,TS val 2248225 ecr 2248191], length 2373
2018-07-24 18:46:09.927602 IP 172.17.0.2.8000 > 172.17.0.1.37436: Flags [P.], seq 1146072652:1146075025, ack 1274675995, win 235, options [nop,nop,TS val 2248258 ecr 2248224], length 2373
2018-07-24 18:46:09.927764 IP 172.17.0.2.8000 > 172.17.0.1.36866: Flags [P.], seq 2726974276:2726976649, ack 3983119563, win 235, options [nop,nop,TS val 2248258 ecr 2248225], length 2373
2018-07-24 18:46:10.267711 IP 172.17.0.2.8000 > 172.17.0.1.37436: Flags [P.], seq 1146075025:1146077140, ack 1274675995, win 235, options [nop,nop,TS val 2248292 ecr 2248258], length 2115
2018-07-24 18:46:10.267912 IP 172.17.0.2.8000 > 172.17.0.1.36866: Flags [P.], seq 2726976649:2726979029, ack 3983119563, win 235, options [nop,nop,TS val 2248292 ecr 2248258], length 2380
2018-07-24 18:46:10.268228 IP 172.17.0.2.8000 > 172.17.0.1.37436: Flags [P.], seq 1146077140:1146077141, ack 1274675995, win 235, options [nop,nop,TS val 2248292 ecr 2248292], length 1
2018-07-24 18:46:10.268342 IP 172.17.0.2.8000 > 172.17.0.1.37436: Flags [P.], seq 1146077141:1146077406, ack 1274675995, win 235, options [nop,nop,TS val 2248292 ecr 2248292], length 265
2018-07-24 18:46:10.608451 IP 172.17.0.2.8000 > 172.17.0.1.37436: Flags [P.], seq 1146077406:1146079793, ack 1274675995, win 235, options [nop,nop,TS val 2248326 ecr 2248292], length 2387
2018-07-24 18:46:10.608674 IP 172.17.0.2.8000 > 172.17.0.1.36866: Flags [P.], seq 2726979029:2726981416, ack 3983119563, win 235, options [nop,nop,TS val 2248326 ecr 2248292], length 2387
2018-07-24 18:46:10.946858 IP 172.17.0.2.8000 > 172.17.0.1.37436: Flags [P.], seq 1146079793:1146082159, ack 1274675995, win 235, options [nop,nop,TS val 2248360 ecr 2248326], length 2366
2018-07-24 18:46:10.946930 IP 172.17.0.2.8000 > 172.17.0.1.36866: Flags [P.], seq 2726981416:2726983782, ack 3983119563, win 235, options [nop,nop,TS val 2248360 ecr 2248326], length 2366
2018-07-24 18:46:11.286416 IP 172.17.0.2.8000 > 172.17.0.1.37436: Flags [P.], seq 1146082159:1146084539, ack 1274675995, win 235, options [nop,nop,TS val 2248394 ecr 2248360], length 2380
2018-07-24 18:46:11.286543 IP 172.17.0.2.8000 > 172.17.0.1.36866: Flags [P.], seq 2726983782:2726986162, ack 3983119563, win 235, options [nop,nop,TS val 2248394 ecr 2248360], length 2380
2018-07-24 18:46:11.626886 IP 172.17.0.2.8000 > 172.17.0.1.37436: Flags [P.], seq 1146084539:1146085333, ack 1274675995, win 235, options [nop,nop,TS val 2248428 ecr 2248394], length 794
2018-07-24 18:46:11.627031 IP 172.17.0.2.8000 > 172.17.0.1.36866: Flags [P.], seq 2726986162:2726988542, ack 3983119563, win 235, options [nop,nop,TS val 2248428 ecr 2248394], length 2380
2018-07-24 18:46:11.627294 IP 172.17.0.2.8000 > 172.17.0.1.37436: Flags [P.], seq 1146085333:1146085334, ack 1274675995, win 235, options [nop,nop,TS val 2248428 ecr 2248428], length 1
2018-07-24 18:46:11.627428 IP 172.17.0.2.8000 > 172.17.0.1.37436: Flags [P.], seq 1146085334:1146086920, ack 1274675995, win 235, options [nop,nop,TS val 2248428 ecr 2248428], length 1586
2018-07-24 18:46:11.966677 IP 172.17.0.2.8000 > 172.17.0.1.37436: Flags [P.], seq 1146086920:1146089300, ack 1274675995, win 235, options [nop,nop,TS val 2248462 ecr 2248428], length 2380
2018-07-24 18:46:11.966943 IP 172.17.0.2.8000 > 172.17.0.1.36866: Flags [P.], seq 2726988542:2726990922, ack 3983119563, win 235, options [nop,nop,TS val 2248462 ecr 2248428], length 2380
2018-07-24 18:46:12.306743 IP 172.17.0.2.8000 > 172.17.0.1.37436: Flags [P.], seq 1146089300:1146091680, ack 1274675995, win 235, options [nop,nop,TS val 2248496 ecr 2248462], length 2380
2018-07-24 18:46:12.306998 IP 172.17.0.2.8000 > 172.17.0.1.36866: Flags [P.], seq 2726990922:2726993302, ack 3983119563, win 235, options [nop,nop,TS val 2248496 ecr 2248462], length 2380
2018-07-24 18:46:12.647628 IP 172.17.0.2.8000 > 172.17.0.1.37436: Flags [P.], seq 1146091680:1146093526, ack 1274675995, win 235, options [nop,nop,TS val 2248530 ecr 2248496], length 1846
2018-07-24 18:46:12.647706 IP 172.17.0.2.8000 > 172.17.0.1.36866: Flags [P.], seq 2726993302:2726995689, ack 3983119563, win 235, options [nop,nop,TS val 2248530 ecr 2248496], length 2387
2018-07-24 18:46:12.647739 IP 172.17.0.2.8000 > 172.17.0.1.37436: Flags [P.], seq 1146093526:1146093527, ack 1274675995, win 235, options [nop,nop,TS val 2248530 ecr 2248530], length 1
2018-07-24 18:46:12.647761 IP 172.17.0.2.8000 > 172.17.0.1.37436: Flags [P.], seq 1146093527:1146094068, ack 1274675995, win 235, options [nop,nop,TS val 2248530 ecr 2248530], length 541
2018-07-24 18:46:12.987167 IP 172.17.0.2.8000 > 172.17.0.1.37436: Flags [P.], seq 1146094068:1146095098, ack 1274675995, win 235, options [nop,nop,TS val 2248564 ecr 2248530], length 1030
2018-07-24 18:46:12.987336 IP 172.17.0.2.8000 > 172.17.0.1.37436: Flags [P.], seq 1146095098:1146096448, ack 1274675995, win 235, options [nop,nop,TS val 2248564 ecr 2248564], length 1350
2018-07-24 18:46:12.987641 IP 172.17.0.2.8000 > 172.17.0.1.36866: Flags [P.], seq 2726995689:2726996719, ack 3983119563, win 235, options [nop,nop,TS val 2248564 ecr 2248530], length 1030
2018-07-24 18:46:12.987945 IP 172.17.0.2.8000 > 172.17.0.1.36866: Flags [P.], seq 2726996719:2726998069, ack 3983119563, win 235, options [nop,nop,TS val 2248564 ecr 2248564], length 1350
2018-07-24 18:46:13.325953 IP 172.17.0.2.8000 > 172.17.0.1.37436: Flags [P.], seq 1146096448:1146098814, ack 1274675995, win 235, options [nop,nop,TS val 2248598 ecr 2248564], length 2366
2018-07-24 18:46:13.326060 IP 172.17.0.2.8000 > 172.17.0.1.36866: Flags [P.], seq 2726998069:2727000435, ack 3983119563, win 235, options [nop,nop,TS val 2248598 ecr 2248564], length 2366
2018-07-24 18:46:13.666084 IP 172.17.0.2.8000 > 172.17.0.1.37436: Flags [P.], seq 1146098814:1146101194, ack 1274675995, win 235, options [nop,nop,TS val 2248632 ecr 2248598], length 2380
2018-07-24 18:46:13.666192 IP 172.17.0.2.8000 > 172.17.0.1.36866: Flags [P.], seq 2727000435:2727002815, ack 3983119563, win 235, options [nop,nop,TS val 2248632 ecr 2248598], length 2380
2018-07-24 18:46:14.005805 IP 172.17.0.2.8000 > 172.17.0.1.37436: Flags [P.], seq 1146101194:1146101719, ack 1274675995, win 235, options [nop,nop,TS val 2248666 ecr 2248632], length 525
2018-07-24 18:46:14.006038 IP 172.17.0.2.8000 > 172.17.0.1.36866: Flags [P.], seq 2727002815:2727005195, ack 3983119563, win 235, options [nop,nop,TS val 2248666 ecr 2248632], length 2380
2018-07-24 18:46:14.006505 IP 172.17.0.2.8000 > 172.17.0.1.37436: Flags [P.], seq 1146101719:1146101720, ack 1274675995, win 235, options [nop,nop,TS val 2248666 ecr 2248666], length 1
2018-07-24 18:46:14.006602 IP 172.17.0.2.8000 > 172.17.0.1.37436: Flags [P.], seq 1146101720:1146103575, ack 1274675995, win 235, options [nop,nop,TS val 2248666 ecr 2248666], length 1855
2018-07-24 18:46:14.345698 IP 172.17.0.2.8000 > 172.17.0.1.37436: Flags [P.], seq 1146103575:1146105955, ack 1274675995, win 235, options [nop,nop,TS val 2248700 ecr 2248666], length 2380
2018-07-24 18:46:14.345843 IP 172.17.0.2.8000 > 172.17.0.1.36866: Flags [P.], seq 2727005195:2727007575, ack 3983119563, win 235, options [nop,nop,TS val 2248700 ecr 2248666], length 2380
2018-07-24 18:46:14.684949 IP 172.17.0.2.8000 > 172.17.0.1.37436: Flags [P.], seq 1146105955:1146108328, ack 1274675995, win 235, options [nop,nop,TS val 2248734 ecr 2248700], length 2373
2018-07-24 18:46:14.685019 IP 172.17.0.2.8000 > 172.17.0.1.36866: Flags [P.], seq 2727007575:2727009948, ack 3983119563, win 235, options [nop,nop,TS val 2248734 ecr 2248700], length 2373
2018-07-24 18:46:15.024975 IP 172.17.0.2.8000 > 172.17.0.1.37436: Flags [P.], seq 1146108328:1146109912, ack 1274675995, win 235, options [nop,nop,TS val 2248768 ecr 2248734], length 1584
2018-07-24 18:46:15.025038 IP 172.17.0.2.8000 > 172.17.0.1.36866: Flags [P.], seq 2727009948:2727012328, ack 3983119563, win 235, options [nop,nop,TS val 2248768 ecr 2248734], length 2380
2018-07-24 18:46:15.025063 IP 172.17.0.2.8000 > 172.17.0.1.37436: Flags [P.], seq 1146109912:1146109913, ack 1274675995, win 235, options [nop,nop,TS val 2248768 ecr 2248768], length 1
2018-07-24 18:46:15.025120 IP 172.17.0.2.8000 > 172.17.0.1.37436: Flags [P.], seq 1146109913:1146110709, ack 1274675995, win 235, options [nop,nop,TS val 2248768 ecr 2248768], length 796
2018-07-24 18:46:15.363949 IP 172.17.0.2.8000 > 172.17.0.1.37436: Flags [P.], seq 1146110709:1146113082, ack 1274675995, win 235, options [nop,nop,TS val 2248802 ecr 2248768], length 2373
2018-07-24 18:46:15.364035 IP 172.17.0.2.8000 > 172.17.0.1.36866: Flags [P.], seq 2727012328:2727014701, ack 3983119563, win 235, options [nop,nop,TS val 2248802 ecr 2248768], length 2373
2018-07-24 18:46:15.703897 IP 172.17.0.2.8000 > 172.17.0.1.37436: Flags [P.], seq 1146113082:1146115462, ack 1274675995, win 235, options [nop,nop,TS val 2248836 ecr 2248802], length 2380
2018-07-24 18:46:15.703970 IP 172.17.0.2.8000 > 172.17.0.1.36866: Flags [P.], seq 2727014701:2727017081, ack 3983119563, win 235, options [nop,nop,TS val 2248836 ecr 2248802], length 2380

