1532456841.259961 IP (tos 0x0, ttl 64, id 15182, offset 0, flags [DF], proto TCP (6), length 2432)
    172.17.0.2.8000 > 172.17.0.1.36866: Flags [P.], cksum 0x6198 (incorrect -> 0xa2e8), seq 2719073593:2719075973, ack 3983119563, win 235, options [nop,nop,TS val 2135392 ecr 2135358], length 2380
1532456841.599436 IP (tos 0x0, ttl 64, id 15184, offset 0, flags [DF], proto TCP (6), length 2432)
    172.17.0.2.8000 > 172.17.0.1.36866: Flags [P.], cksum 0x6198 (incorrect -> 0x9d05), seq 2719075973:2719078353, ack 3983119563, win 235, options [nop,nop,TS val 2135426 ecr 2135392], length 2380
1532456841.939515 IP (tos 0x0, ttl 64, id 15186, offset 0, flags [DF], proto TCP (6), length 2432)
    172.17.0.2.8000 > 172.17.0.1.36866: Flags [P.], cksum 0x6198 (incorrect -> 0x330e), seq 2719078353:2719080733, ack 3983119563, win 235, options [nop,nop,TS val 2135460 ecr 2135426], length 2380
1532456842.278793 IP (tos 0x0, ttl 64, id 15188, offset 0, flags [DF], proto TCP (6), length 2425)
    172.17.0.2.8000 > 172.17.0.1.36866: Flags [P.], cksum 0x6191 (incorrect -> 0x9567), seq 2719080733:2719083106, ack 3983119563, win 235, options [nop,nop,TS val 2135493 ecr 2135460], length 2373
1532456842.619157 IP (tos 0x0, ttl 64, id 15190, offset 0, flags [DF], proto TCP (6), length 2439)
    172.17.0.2.8000 > 172.17.0.1.36866: Flags [P.], cksum 0x619f (incorrect -> 0x340a), seq 2719083106:2719085493, ack 3983119563, win 235, options [nop,nop,TS val 2135528 ecr 2135493], length 2387
1532456842.957969 IP (tos 0x0, ttl 64, id 15192, offset 0, flags [DF], proto TCP (6), length 2418)
    172.17.0.2.8000 > 172.17.0.1.36866: Flags [P.], cksum 0x618a (incorrect -> 0x9ea3), seq 2719085493:2719087859, ack 3983119563, win 235, options [nop,nop,TS val 2135561 ecr 2135528], length 2366
1532456843.294774 IP (tos 0x0, ttl 64, id 15194, offset 0, flags [DF], proto TCP (6), length 2411)
    172.17.0.2.8000 > 172.17.0.1.36866: Flags [P.], cksum 0x6183 (incorrect -> 0x12ab), seq 2719087859:2719090218, ack 3983119563, win 235, options [nop,nop,TS val 2135595 ecr 2135561], length 2359
1532456843.632457 IP (tos 0x0, ttl 64, id 15196, offset 0, flags [DF], proto TCP (6), length 2418)
    172.17.0.2.8000 > 172.17.0.1.36866: Flags [P.], cksum 0x618a (incorrect -> 0xdef9), seq 2719090218:2719092584, ack 3983119563, win 235, options [nop,nop,TS val 2135629 ecr 2135595], length 2366
1532456843.971452 IP (tos 0x0, ttl 64, id 15198, offset 0, flags [DF], proto TCP (6), length 2425)
    172.17.0.2.8000 > 172.17.0.1.36866: Flags [P.], cksum 0x6191 (incorrect -> 0x951c), seq 2719092584:2719094957, ack 3983119563, win 235, options [nop,nop,TS val 2135663 ecr 2135629], length 2373
1532456844.310611 IP (tos 0x0, ttl 64, id 15200, offset 0, flags [DF], proto TCP (6), length 2425)
    172.17.0.2.8000 > 172.17.0.1.36866: Flags [P.], cksum 0x6191 (incorrect -> 0x1444), seq 2719094957:2719097330, ack 3983119563, win 235, options [nop,nop,TS val 2135697 ecr 2135663], length 2373
1532456844.650814 IP (tos 0x0, ttl 64, id 15202, offset 0, flags [DF], proto TCP (6), length 2432)
    172.17.0.2.8000 > 172.17.0.1.36866: Flags [P.], cksum 0x6198 (incorrect -> 0x06d8), seq 2719097330:2719099710, ack 3983119563, win 235, options [nop,nop,TS val 2135731 ecr 2135697], length 2380
1532456844.990451 IP (tos 0x0, ttl 64, id 15204, offset 0, flags [DF], proto TCP (6), length 2432)
    172.17.0.2.8000 > 172.17.0.1.36866: Flags [P.], cksum 0x6198 (incorrect -> 0x7b94), seq 2719099710:2719102090, ack 3983119563, win 235, options [nop,nop,TS val 2135765 ecr 2135731], length 2380
1532456845.332007 IP (tos 0x0, ttl 64, id 15206, offset 0, flags [DF], proto TCP (6), length 2439)
    172.17.0.2.8000 > 172.17.0.1.36866: Flags [P.], cksum 0x619f (incorrect -> 0x46ff), seq 2719102090:2719104477, ack 3983119563, win 235, options [nop,nop,TS val 2135799 ecr 2135765], length 2387
1532456845.672360 IP (tos 0x0, ttl 64, id 15208, offset 0, flags [DF], proto TCP (6), length 2439)
    172.17.0.2.8000 > 172.17.0.1.36866: Flags [P.], cksum 0x619f (incorrect -> 0xab3e), seq 2719104477:2719106864, ack 3983119563, win 235, options [nop,nop,TS val 2135833 ecr 2135799], length 2387
1532456846.013027 IP (tos 0x0, ttl 64, id 15210, offset 0, flags [DF], proto TCP (6), length 2432)
    172.17.0.2.8000 > 172.17.0.1.36866: Flags [P.], cksum 0x6198 (incorrect -> 0xbfef), seq 2719106864:2719109244, ack 3983119563, win 235, options [nop,nop,TS val 2135867 ecr 2135833], length 2380
1532456846.352592 IP (tos 0x0, ttl 64, id 15212, offset 0, flags [DF], proto TCP (6), length 2432)
    172.17.0.2.8000 > 172.17.0.1.36866: Flags [P.], cksum 0x6198 (incorrect -> 0x8b3e), seq 2719109244:2719111624, ack 3983119563, win 235, options [nop,nop,TS val 2135901 ecr 2135867], length 2380
1532456846.690842 IP (tos 0x0, ttl 64, id 15214, offset 0, flags [DF], proto TCP (6), length 2418)
    172.17.0.2.8000 > 172.17.0.1.36866: Flags [P.], cksum 0x618a (incorrect -> 0x5ab6), seq 2719111624:2719113990, ack 3983119563, win 235, options [nop,nop,TS val 2135935 ecr 2135901], length 2366
1532456847.029841 IP (tos 0x0, ttl 64, id 15216, offset 0, flags [DF], proto TCP (6), length 2425)
    172.17.0.2.8000 > 172.17.0.1.36866: Flags [P.], cksum 0x6191 (incorrect -> 0x577f), seq 2719113990:2719116363, ack 3983119563, win 235, options [nop,nop,TS val 2135969 ecr 2135935], length 2373
1532456847.369428 IP (tos 0x0, ttl 64, id 15218, offset 0, flags [DF], proto TCP (6), length 2432)
    172.17.0.2.8000 > 172.17.0.1.36866: Flags [P.], cksum 0x6198 (incorrect -> 0xd1c3), seq 2719116363:2719118743, ack 3983119563, win 235, options [nop,nop,TS val 2136003 ecr 2135969], length 2380
1532456847.708922 IP (tos 0x0, ttl 64, id 15220, offset 0, flags [DF], proto TCP (6), length 2425)
    172.17.0.2.8000 > 172.17.0.1.36866: Flags [P.], cksum 0x6191 (incorrect -> 0xebca), seq 2719118743:2719121116, ack 3983119563, win 235, options [nop,nop,TS val 2136036 ecr 2136003], length 2373
1532456848.048144 IP (tos 0x0, ttl 64, id 15222, offset 0, flags [DF], proto TCP (6), length 2425)
    172.17.0.2.8000 > 172.17.0.1.36866: Flags [P.], cksum 0x6191 (incorrect -> 0x0014), seq 2719121116:2719123489, ack 3983119563, win 235, options [nop,nop,TS val 2136070 ecr 2136036], length 2373
1532456848.388638 IP (tos 0x0, ttl 64, id 15224, offset 0, flags [DF], proto TCP (6), length 2439)
    172.17.0.2.8000 > 172.17.0.1.36866: Flags [P.], cksum 0x619f (incorrect -> 0x6f1b), seq 2719123489:2719125876, ack 3983119563, win 235, options [nop,nop,TS val 2136104 ecr 2136070], length 2387
1532456848.728583 IP (tos 0x0, ttl 64, id 15226, offset 0, flags [DF], proto TCP (6), length 2432)
    172.17.0.2.8000 > 172.17.0.1.36866: Flags [P.], cksum 0x6198 (incorrect -> 0x3b40), seq 2719125876:2719128256, ack 3983119563, win 235, options [nop,nop,TS val 2136138 ecr 2136104], length 2380
1532456849.068659 IP (tos 0x0, ttl 64, id 15228, offset 0, flags [DF], proto TCP (6), length 2432)
    172.17.0.2.8000 > 172.17.0.1.36866: Flags [P.], cksum 0x6198 (incorrect -> 0x2407), seq 2719128256:2719130636, ack 3983119563, win 235, options [nop,nop,TS val 2136172 ecr 2136138], length 2380
1532456849.409487 IP (tos 0x0, ttl 64, id 15230, offset 0, flags [DF], proto TCP (6), length 1815)
    172.17.0.2.8000 > 172.17.0.1.36866: Flags [P.], cksum 0x5f2f (incorrect -> 0x488b), seq 2719130636:2719132399, ack 3983119563, win 235, options [nop,nop,TS val 2136207 ecr 2136172], length 1763
1532456849.409636 IP (tos 0x0, ttl 64, id 15232, offset 0, flags [DF], proto TCP (6), length 676)
    172.17.0.2.8000 > 172.17.0.1.36866: Flags [P.], cksum 0x5abc (incorrect -> 0x1a97), seq 2719132399:2719133023, ack 3983119563, win 235, options [nop,nop,TS val 2136207 ecr 2136207], length 624
1532456849.748924 IP (tos 0x0, ttl 64, id 15233, offset 0, flags [DF], proto TCP (6), length 2425)
    172.17.0.2.8000 > 172.17.0.1.36866: Flags [P.], cksum 0x6191 (incorrect -> 0xd761), seq 2719133023:2719135396, ack 3983119563, win 235, options [nop,nop,TS val 2136240 ecr 2136207], length 2373
1532456850.089148 IP (tos 0x0, ttl 64, id 15235, offset 0, flags [DF], proto TCP (6), length 2432)
    172.17.0.2.8000 > 172.17.0.1.36866: Flags [P.], cksum 0x6198 (incorrect -> 0x4c5f), seq 2719135396:2719137776, ack 3983119563, win 235, options [nop,nop,TS val 2136275 ecr 2136240], length 2380
1532456850.427479 IP (tos 0x0, ttl 64, id 15237, offset 0, flags [DF], proto TCP (6), length 2425)
    172.17.0.2.8000 > 172.17.0.1.36866: Flags [P.], cksum 0x6191 (incorrect -> 0xd84d), seq 2719137776:2719140149, ack 3983119563, win 235, options [nop,nop,TS val 2136308 ecr 2136275], length 2373
1532456850.761765 IP (tos 0x0, ttl 64, id 15239, offset 0, flags [DF], proto TCP (6), length 2390)
    172.17.0.2.8000 > 172.17.0.1.36866: Flags [P.], cksum 0x616e (incorrect -> 0x10b5), seq 2719140149:2719142487, ack 3983119563, win 235, options [nop,nop,TS val 2136342 ecr 2136308], length 2338
1532456851.098764 IP (tos 0x0, ttl 64, id 15241, offset 0, flags [DF], proto TCP (6), length 2411)
    172.17.0.2.8000 > 172.17.0.1.36866: Flags [P.], cksum 0x6183 (incorrect -> 0x45ee), seq 2719142487:2719144846, ack 3983119563, win 235, options [nop,nop,TS val 2136375 ecr 2136342], length 2359
1532456851.436623 IP (tos 0x0, ttl 64, id 15243, offset 0, flags [DF], proto TCP (6), length 2418)
    172.17.0.2.8000 > 172.17.0.1.36866: Flags [P.], cksum 0x618a (incorrect -> 0x958f), seq 2719144846:2719147212, ack 3983119563, win 235, options [nop,nop,TS val 2136409 ecr 2136375], length 2366
1532456851.774380 IP (tos 0x0, ttl 64, id 15245, offset 0, flags [DF], proto TCP (6), length 2418)
    172.17.0.2.8000 > 172.17.0.1.36866: Flags [P.], cksum 0x618a (incorrect -> 0x2f99), seq 2719147212:2719149578, ack 3983119563, win 235, options [nop,nop,TS val 2136443 ecr 2136409], length 2366
1532456852.114997 IP (tos 0x0, ttl 64, id 15247, offset 0, flags [DF], proto TCP (6), length 2432)
    172.17.0.2.8000 > 172.17.0.1.36866: Flags [P.], cksum 0x6198 (incorrect -> 0x83d4), seq 2719149578:2719151958, ack 3983119563, win 235, options [nop,nop,TS val 2136477 ecr 2136443], length 2380
1532456852.455564 IP (tos 0x0, ttl 64, id 15249, offset 0, flags [DF], proto TCP (6), length 2439)
    172.17.0.2.8000 > 172.17.0.1.36866: Flags [P.], cksum 0x619f (incorrect -> 0xd3e4), seq 2719151958:2719154345, ack 3983119563, win 235, options [nop,nop,TS val 2136511 ecr 2136477], length 2387
1532456852.794822 IP (tos 0x0, ttl 64, id 15251, offset 0, flags [DF], proto TCP (6), length 2425)
    172.17.0.2.8000 > 172.17.0.1.36866: Flags [P.], cksum 0x6191 (incorrect -> 0x6071), seq 2719154345:2719156718, ack 3983119563, win 235, options [nop,nop,TS val 2136545 ecr 2136511], length 2373
1532456853.133738 IP (tos 0x0, ttl 64, id 15253, offset 0, flags [DF], proto TCP (6), length 2425)
    172.17.0.2.8000 > 172.17.0.1.36866: Flags [P.], cksum 0x6191 (incorrect -> 0x677d), seq 2719156718:2719159091, ack 3983119563, win 235, options [nop,nop,TS val 2136579 ecr 2136545], length 2373
1532456853.473203 IP (tos 0x0, ttl 64, id 15255, offset 0, flags [DF], proto TCP (6), length 2432)
    172.17.0.2.8000 > 172.17.0.1.36866: Flags [P.], cksum 0x6198 (incorrect -> 0x0299), seq 2719159091:2719161471, ack 3983119563, win 235, options [nop,nop,TS val 2136613 ecr 2136579], length 2380
1532456853.813634 IP (tos 0x0, ttl 64, id 15257, offset 0, flags [DF], proto TCP (6), length 2432)
    172.17.0.2.8000 > 172.17.0.1.36866: Flags [P.], cksum 0x6198 (incorrect -> 0xaa6a), seq 2719161471:2719163851, ack 3983119563, win 235, options [nop,nop,TS val 2136647 ecr 2136613], length 2380
1532456854.152493 IP (tos 0x0, ttl 64, id 15259, offset 0, flags [DF], proto TCP (6), length 2425)
    172.17.0.2.8000 > 172.17.0.1.36866: Flags [P.], cksum 0x6191 (incorrect -> 0xb148), seq 2719163851:2719166224, ack 3983119563, win 235, options [nop,nop,TS val 2136681 ecr 2136647], length 2373
1532456854.488496 IP (tos 0x0, ttl 64, id 15261, offset 0, flags [DF], proto TCP (6), length 2404)
    172.17.0.2.8000 > 172.17.0.1.36866: Flags [P.], cksum 0x617c (incorrect -> 0xa397), seq 2719166224:2719168576, ack 3983119563, win 235, options [nop,nop,TS val 2136714 ecr 2136681], length 2352
1532456854.826265 IP (tos 0x0, ttl 64, id 15263, offset 0, flags [DF], proto TCP (6), length 2418)
    172.17.0.2.8000 > 172.17.0.1.36866: Flags [P.], cksum 0x618a (incorrect -> 0x92ad), seq 2719168576:2719170942, ack 3983119563, win 235, options [nop,nop,TS val 2136748 ecr 2136714], length 2366
1532456855.168342 IP (tos 0x0, ttl 64, id 15265, offset 0, flags [DF], proto TCP (6), length 2446)
    172.17.0.2.8000 > 172.17.0.1.36866: Flags [P.], cksum 0x61a6 (incorrect -> 0xa6d0), seq 2719170942:2719173336, ack 3983119563, win 235, options [nop,nop,TS val 2136782 ecr 2136748], length 2394
1532456855.511564 IP (tos 0x0, ttl 64, id 15267, offset 0, flags [DF], proto TCP (6), length 2453)
    172.17.0.2.8000 > 172.17.0.1.36866: Flags [P.], cksum 0x61ad (incorrect -> 0x7dfc), seq 2719173336:2719175737, ack 3983119563, win 235, options [nop,nop,TS val 2136817 ecr 2136782], length 2401
1532456855.895237 IP (tos 0x0, ttl 64, id 15269, offset 0, flags [DF], proto TCP (6), length 2733)
    172.17.0.2.8000 > 172.17.0.1.36866: Flags [P.], cksum 0x62c5 (incorrect -> 0x1dc3), seq 2719175737:2719178418, ack 3983119563, win 235, options [nop,nop,TS val 2136855 ecr 2136817], length 2681
1532456856.259479 IP (tos 0x0, ttl 64, id 15271, offset 0, flags [DF], proto TCP (6), length 2586)
    172.17.0.2.8000 > 172.17.0.1.36866: Flags [P.], cksum 0x6232 (incorrect -> 0xc3b9), seq 2719178418:2719180952, ack 3983119563, win 235, options [nop,nop,TS val 2136891 ecr 2136855], length 2534
1532456856.409921 IP (tos 0x0, ttl 64, id 39292, offset 0, flags [DF], proto TCP (6), length 286)
    172.17.0.1.37436 > 172.17.0.2.8000: Flags [P.], cksum 0x5936 (incorrect -> 0x957f), seq 1274675761:1274675995, ack 1138244100, win 229, options [nop,nop,TS val 2136907 ecr 2136906], length 234
1532456856.410972 IP (tos 0x0, ttl 64, id 41296, offset 0, flags [DF], proto TCP (6), length 345)
    172.17.0.2.8000 > 172.17.0.1.37436: Flags [P.], cksum 0x5971 (incorrect -> 0x15b1), seq 1138244100:1138244393, ack 1274675995, win 235, options [nop,nop,TS val 2136907 ecr 2136907], length 293
1532456856.411026 IP (tos 0x0, ttl 64, id 41302, offset 0, flags [DF], proto TCP (6), length 1004)
    172.17.0.2.8000 > 172.17.0.1.37436: Flags [P.], cksum 0x5c04 (incorrect -> 0xc7b4), seq 1138251633:1138252585, ack 1274675995, win 235, options [nop,nop,TS val 2136907 ecr 2136907], length 952
1532456856.411068 IP (tos 0x0, ttl 64, id 41308, offset 0, flags [DF], proto TCP (6), length 1069)
    172.17.0.2.8000 > 172.17.0.1.37436: Flags [P.], cksum 0x5c45 (incorrect -> 0xe861), seq 1138259825:1138260842, ack 1274675995, win 235, options [nop,nop,TS val 2136907 ecr 2136907], length 1017
1532456856.411089 IP (tos 0x0, ttl 64, id 41314, offset 0, flags [DF], proto TCP (6), length 1005)
    172.17.0.2.8000 > 172.17.0.1.37436: Flags [P.], cksum 0x5c05 (incorrect -> 0xf6ac), seq 1138268082:1138269035, ack 1274675995, win 235, options [nop,nop,TS val 2136907 ecr 2136907], length 953
1532456856.411102 IP (tos 0x0, ttl 64, id 41315, offset 0, flags [DF], proto TCP (6), length 53)
    172.17.0.2.8000 > 172.17.0.1.37436: Flags [P.], cksum 0x584d (incorrect -> 0x06f7), seq 1138269035:1138269036, ack 1274675995, win 235, options [nop,nop,TS val 2136907 ecr 2136907], length 1
1532456856.411111 IP (tos 0x0, ttl 64, id 41316, offset 0, flags [DF], proto TCP (6), length 8244)
    172.17.0.2.8000 > 172.17.0.1.37436: Flags [P.], cksum 0x784c (incorrect -> 0x7295), seq 1138269036:1138277228, ack 1274675995, win 235, options [nop,nop,TS val 2136907 ecr 2136907], length 8192
1532456856.411139 IP (tos 0x0, ttl 64, id 41322, offset 0, flags [DF], proto TCP (6), length 53)
    172.17.0.2.8000 > 172.17.0.1.37436: Flags [P.], cksum 0x584d (incorrect -> 0xe6f5), seq 1138277228:1138277229, ack 1274675995, win 235, options [nop,nop,TS val 2136907 ecr 2136907], length 1
1532456856.411148 IP (tos 0x0, ttl 64, id 41323, offset 0, flags [DF], proto TCP (6), length 1024)
    172.17.0.2.8000 > 172.17.0.1.37436: Flags [P.], cksum 0x5c18 (incorrect -> 0xa6ee), seq 1138277229:1138278201, ack 1274675995, win 235, options [nop,nop,TS val 2136907 ecr 2136907], length 972
1532456856.595359 IP (tos 0x0, ttl 64, id 41324, offset 0, flags [DF], proto TCP (6), length 2411)
    172.17.0.2.8000 > 172.17.0.1.37436: Flags [P.], cksum 0x6183 (incorrect -> 0x5468), seq 1138278201:1138280560, ack 1274675995, win 235, options [nop,nop,TS val 2136925 ecr 2136907], length 2359
1532456856.595526 IP (tos 0x0, ttl 64, id 15273, offset 0, flags [DF], proto TCP (6), length 2411)
    172.17.0.2.8000 > 172.17.0.1.36866: Flags [P.], cksum 0x6183 (incorrect -> 0x1bf8), seq 2719180952:2719183311, ack 3983119563, win 235, options [nop,nop,TS val 2136925 ecr 2136891], length 2359
1532456856.933021 IP (tos 0x0, ttl 64, id 41326, offset 0, flags [DF], proto TCP (6), length 2425)
    172.17.0.2.8000 > 172.17.0.1.37436: Flags [P.], cksum 0x6191 (incorrect -> 0x3491), seq 1138280560:1138282933, ack 1274675995, win 235, options [nop,nop,TS val 2136959 ecr 2136925], length 2373
1532456856.933088 IP (tos 0x0, ttl 64, id 15275, offset 0, flags [DF], proto TCP (6), length 2425)
    172.17.0.2.8000 > 172.17.0.1.36866: Flags [P.], cksum 0x6191 (incorrect -> 0xfc10), seq 2719183311:2719185684, ack 3983119563, win 235, options [nop,nop,TS val 2136959 ecr 2136925], length 2373
1532456857.272215 IP (tos 0x0, ttl 64, id 41328, offset 0, flags [DF], proto TCP (6), length 2425)
    172.17.0.2.8000 > 172.17.0.1.37436: Flags [P.], cksum 0x6191 (incorrect -> 0x31d9), seq 1138282933:1138285306, ack 1274675995, win 235, options [nop,nop,TS val 2136993 ecr 2136959], length 2373
1532456857.272285 IP (tos 0x0, ttl 64, id 15277, offset 0, flags [DF], proto TCP (6), length 2425)
    172.17.0.2.8000 > 172.17.0.1.36866: Flags [P.], cksum 0x6191 (incorrect -> 0xf958), seq 2719185684:2719188057, ack 3983119563, win 235, options [nop,nop,TS val 2136993 ecr 2136959], length 2373
1532456857.611854 IP (tos 0x0, ttl 64, id 41330, offset 0, flags [DF], proto TCP (6), length 167)
    172.17.0.2.8000 > 172.17.0.1.37436: Flags [P.], cksum 0x58bf (incorrect -> 0x110e), seq 1138285306:1138285421, ack 1274675995, win 235, options [nop,nop,TS val 2137027 ecr 2136993], length 115
1532456857.611924 IP (tos 0x0, ttl 64, id 15279, offset 0, flags [DF], proto TCP (6), length 2432)
    172.17.0.2.8000 > 172.17.0.1.36866: Flags [P.], cksum 0x6198 (incorrect -> 0x1ddb), seq 2719188057:2719190437, ack 3983119563, win 235, options [nop,nop,TS val 2137027 ecr 2136993], length 2380
1532456857.611951 IP (tos 0x0, ttl 64, id 41331, offset 0, flags [DF], proto TCP (6), length 53)
    172.17.0.2.8000 > 172.17.0.1.37436: Flags [P.], cksum 0x584d (incorrect -> 0xc604), seq 1138285421:1138285422, ack 1274675995, win 235, options [nop,nop,TS val 2137027 ecr 2137027], length 1
1532456857.611966 IP (tos 0x0, ttl 64, id 41332, offset 0, flags [DF], proto TCP (6), length 2317)
    172.17.0.2.8000 > 172.17.0.1.37436: Flags [P.], cksum 0x6125 (incorrect -> 0xe379), seq 1138285422:1138287687, ack 1274675995, win 235, options [nop,nop,TS val 2137027 ecr 2137027], length 2265
1532456857.950894 IP (tos 0x0, ttl 64, id 41334, offset 0, flags [DF], proto TCP (6), length 2425)
    172.17.0.2.8000 > 172.17.0.1.37436: Flags [P.], cksum 0x6191 (incorrect -> 0x6eec), seq 1138287687:1138290060, ack 1274675995, win 235, options [nop,nop,TS val 2137061 ecr 2137027], length 2373
1532456857.950983 IP (tos 0x0, ttl 64, id 15281, offset 0, flags [DF], proto TCP (6), length 2425)
    172.17.0.2.8000 > 172.17.0.1.36866: Flags [P.], cksum 0x6191 (incorrect -> 0x366d), seq 2719190437:2719192810, ack 3983119563, win 235, options [nop,nop,TS val 2137061 ecr 2137027], length 2373
1532456858.290712 IP (tos 0x0, ttl 64, id 41336, offset 0, flags [DF], proto TCP (6), length 2432)
    172.17.0.2.8000 > 172.17.0.1.37436: Flags [P.], cksum 0x6198 (incorrect -> 0xf80e), seq 1138290060:1138292440, ack 1274675995, win 235, options [nop,nop,TS val 2137095 ecr 2137061], length 2380
1532456858.290788 IP (tos 0x0, ttl 64, id 15283, offset 0, flags [DF], proto TCP (6), length 2432)
    172.17.0.2.8000 > 172.17.0.1.36866: Flags [P.], cksum 0x6198 (incorrect -> 0xbf8f), seq 2719192810:2719195190, ack 3983119563, win 235, options [nop,nop,TS val 2137095 ecr 2137061], length 2380
1532456858.629552 IP (tos 0x0, ttl 64, id 41338, offset 0, flags [DF], proto TCP (6), length 1226)
    172.17.0.2.8000 > 172.17.0.1.37436: Flags [P.], cksum 0x5ce2 (incorrect -> 0xa60e), seq 1138292440:1138293614, ack 1274675995, win 235, options [nop,nop,TS val 2137129 ecr 2137095], length 1174
1532456858.629612 IP (tos 0x0, ttl 64, id 15285, offset 0, flags [DF], proto TCP (6), length 2425)
    172.17.0.2.8000 > 172.17.0.1.36866: Flags [P.], cksum 0x6191 (incorrect -> 0x5786), seq 2719195190:2719197563, ack 3983119563, win 235, options [nop,nop,TS val 2137129 ecr 2137095], length 2373
1532456858.629635 IP (tos 0x0, ttl 64, id 41339, offset 0, flags [DF], proto TCP (6), length 53)
    172.17.0.2.8000 > 172.17.0.1.37436: Flags [P.], cksum 0x584d (incorrect -> 0xa537), seq 1138293614:1138293615, ack 1274675995, win 235, options [nop,nop,TS val 2137129 ecr 2137129], length 1
1532456858.629645 IP (tos 0x0, ttl 64, id 41340, offset 0, flags [DF], proto TCP (6), length 1251)
    172.17.0.2.8000 > 172.17.0.1.37436: Flags [P.], cksum 0x5cfb (incorrect -> 0x8f2e), seq 1138293615:1138294814, ack 1274675995, win 235, options [nop,nop,TS val 2137129 ecr 2137129], length 1199
1532456858.967656 IP (tos 0x0, ttl 64, id 41341, offset 0, flags [DF], proto TCP (6), length 2418)
    172.17.0.2.8000 > 172.17.0.1.37436: Flags [P.], cksum 0x618a (incorrect -> 0x8415), seq 1138294814:1138297180, ack 1274675995, win 235, options [nop,nop,TS val 2137162 ecr 2137129], length 2366
1532456858.967836 IP (tos 0x0, ttl 64, id 15287, offset 0, flags [DF], proto TCP (6), length 2418)
    172.17.0.2.8000 > 172.17.0.1.36866: Flags [P.], cksum 0x618a (incorrect -> 0x4b97), seq 2719197563:2719199929, ack 3983119563, win 235, options [nop,nop,TS val 2137162 ecr 2137129], length 2366
1532456859.306248 IP (tos 0x0, ttl 64, id 41343, offset 0, flags [DF], proto TCP (6), length 2425)
    172.17.0.2.8000 > 172.17.0.1.37436: Flags [P.], cksum 0x6191 (incorrect -> 0xae2c), seq 1138297180:1138299553, ack 1274675995, win 235, options [nop,nop,TS val 2137196 ecr 2137162], length 2373
1532456859.306391 IP (tos 0x0, ttl 64, id 15289, offset 0, flags [DF], proto TCP (6), length 2425)
    172.17.0.2.8000 > 172.17.0.1.36866: Flags [P.], cksum 0x6191 (incorrect -> 0x75ae), seq 2719199929:2719202302, ack 3983119563, win 235, options [nop,nop,TS val 2137196 ecr 2137162], length 2373
1532456859.644898 IP (tos 0x0, ttl 64, id 41345, offset 0, flags [DF], proto TCP (6), length 2306)
    172.17.0.2.8000 > 172.17.0.1.37436: Flags [P.], cksum 0x611a (incorrect -> 0x0c2a), seq 1138299553:1138301807, ack 1274675995, win 235, options [nop,nop,TS val 2137230 ecr 2137196], length 2254
1532456859.645078 IP (tos 0x0, ttl 64, id 15291, offset 0, flags [DF], proto TCP (6), length 2418)
    172.17.0.2.8000 > 172.17.0.1.36866: Flags [P.], cksum 0x618a (incorrect -> 0x74f4), seq 2719202302:2719204668, ack 3983119563, win 235, options [nop,nop,TS val 2137230 ecr 2137196], length 2366
1532456859.645593 IP (tos 0x0, ttl 64, id 41347, offset 0, flags [DF], proto TCP (6), length 53)
    172.17.0.2.8000 > 172.17.0.1.37436: Flags [P.], cksum 0x584d (incorrect -> 0x846c), seq 1138301807:1138301808, ack 1274675995, win 235, options [nop,nop,TS val 2137230 ecr 2137230], length 1
1532456859.645916 IP (tos 0x0, ttl 64, id 41348, offset 0, flags [DF], proto TCP (6), length 164)
    172.17.0.2.8000 > 172.17.0.1.37436: Flags [P.], cksum 0x58bc (incorrect -> 0x25b5), seq 1138301808:1138301920, ack 1274675995, win 235, options [nop,nop,TS val 2137230 ecr 2137230], length 112
1532456859.983337 IP (tos 0x0, ttl 64, id 41349, offset 0, flags [DF], proto TCP (6), length 2425)
    172.17.0.2.8000 > 172.17.0.1.37436: Flags [P.], cksum 0x6191 (incorrect -> 0xa6d6), seq 1138301920:1138304293, ack 1274675995, win 235, options [nop,nop,TS val 2137264 ecr 2137230], length 2373
1532456859.985942 IP (tos 0x0, ttl 64, id 15293, offset 0, flags [DF], proto TCP (6), length 2425)
    172.17.0.2.8000 > 172.17.0.1.36866: Flags [P.], cksum 0x6191 (incorrect -> 0x6e59), seq 2719204668:2719207041, ack 3983119563, win 235, options [nop,nop,TS val 2137264 ecr 2137230], length 2373
1532456860.325822 IP (tos 0x0, ttl 64, id 41351, offset 0, flags [DF], proto TCP (6), length 2446)
    172.17.0.2.8000 > 172.17.0.1.37436: Flags [P.], cksum 0x61a6 (incorrect -> 0x4b76), seq 1138304293:1138306687, ack 1274675995, win 235, options [nop,nop,TS val 2137298 ecr 2137264], length 2394
1532456860.326109 IP (tos 0x0, ttl 64, id 15295, offset 0, flags [DF], proto TCP (6), length 2446)
    172.17.0.2.8000 > 172.17.0.1.36866: Flags [P.], cksum 0x61a6 (incorrect -> 0x12f9), seq 2719207041:2719209435, ack 3983119563, win 235, options [nop,nop,TS val 2137298 ecr 2137264], length 2394
1532456860.665806 IP (tos 0x0, ttl 64, id 41353, offset 0, flags [DF], proto TCP (6), length 2432)
    172.17.0.2.8000 > 172.17.0.1.37436: Flags [P.], cksum 0x6198 (incorrect -> 0xfa11), seq 1138306687:1138309067, ack 1274675995, win 235, options [nop,nop,TS val 2137332 ecr 2137298], length 2380
1532456860.665947 IP (tos 0x0, ttl 64, id 15297, offset 0, flags [DF], proto TCP (6), length 2432)
    172.17.0.2.8000 > 172.17.0.1.36866: Flags [P.], cksum 0x6198 (incorrect -> 0xc194), seq 2719209435:2719211815, ack 3983119563, win 235, options [nop,nop,TS val 2137332 ecr 2137298], length 2380
1532456861.006170 IP (tos 0x0, ttl 64, id 41355, offset 0, flags [DF], proto TCP (6), length 985)
    172.17.0.2.8000 > 172.17.0.1.37436: Flags [P.], cksum 0x5bf1 (incorrect -> 0xed9e), seq 1138309067:1138310000, ack 1274675995, win 235, options [nop,nop,TS val 2137366 ecr 2137332], length 933
1532456861.006643 IP (tos 0x0, ttl 64, id 15299, offset 0, flags [DF], proto TCP (6), length 2439)
    172.17.0.2.8000 > 172.17.0.1.36866: Flags [P.], cksum 0x619f (incorrect -> 0xcee6), seq 2719211815:2719214202, ack 3983119563, win 235, options [nop,nop,TS val 2137366 ecr 2137332], length 2387
1532456861.006997 IP (tos 0x0, ttl 64, id 41356, offset 0, flags [DF], proto TCP (6), length 53)
    172.17.0.2.8000 > 172.17.0.1.37436: Flags [P.], cksum 0x584d (incorrect -> 0x635b), seq 1138310000:1138310001, ack 1274675995, win 235, options [nop,nop,TS val 2137366 ecr 2137366], length 1
1532456861.007145 IP (tos 0x0, ttl 64, id 41357, offset 0, flags [DF], proto TCP (6), length 1506)
    172.17.0.2.8000 > 172.17.0.1.37436: Flags [P.], cksum 0x5dfa (incorrect -> 0xd0cc), seq 1138310001:1138311455, ack 1274675995, win 235, options [nop,nop,TS val 2137366 ecr 2137366], length 1454
1532456861.343776 IP (tos 0x0, ttl 64, id 41359, offset 0, flags [DF], proto TCP (6), length 2411)
    172.17.0.2.8000 > 172.17.0.1.37436: Flags [P.], cksum 0x6183 (incorrect -> 0xaef1), seq 1138311455:1138313814, ack 1274675995, win 235, options [nop,nop,TS val 2137400 ecr 2137366], length 2359
1532456861.343918 IP (tos 0x0, ttl 64, id 15301, offset 0, flags [DF], proto TCP (6), length 2411)
    172.17.0.2.8000 > 172.17.0.1.36866: Flags [P.], cksum 0x6183 (incorrect -> 0x7675), seq 2719214202:2719216561, ack 3983119563, win 235, options [nop,nop,TS val 2137400 ecr 2137366], length 2359
1532456861.683182 IP (tos 0x0, ttl 64, id 41361, offset 0, flags [DF], proto TCP (6), length 2432)
    172.17.0.2.8000 > 172.17.0.1.37436: Flags [P.], cksum 0x6198 (incorrect -> 0x0f6b), seq 1138313814:1138316194, ack 1274675995, win 235, options [nop,nop,TS val 2137434 ecr 2137400], length 2380
1532456861.683397 IP (tos 0x0, ttl 64, id 15303, offset 0, flags [DF], proto TCP (6), length 2432)
    172.17.0.2.8000 > 172.17.0.1.36866: Flags [P.], cksum 0x6198 (incorrect -> 0xd6ee), seq 2719216561:2719218941, ack 3983119563, win 235, options [nop,nop,TS val 2137434 ecr 2137400], length 2380
1532456862.022290 IP (tos 0x0, ttl 64, id 41363, offset 0, flags [DF], proto TCP (6), length 2051)
    172.17.0.2.8000 > 172.17.0.1.37436: Flags [P.], cksum 0x601b (incorrect -> 0xfeeb), seq 1138316194:1138318193, ack 1274675995, win 235, options [nop,nop,TS val 2137468 ecr 2137434], length 1999
1532456862.022785 IP (tos 0x0, ttl 64, id 15305, offset 0, flags [DF], proto TCP (6), length 2425)
    172.17.0.2.8000 > 172.17.0.1.36866: Flags [P.], cksum 0x6191 (incorrect -> 0x83b7), seq 2719218941:2719221314, ack 3983119563, win 235, options [nop,nop,TS val 2137468 ecr 2137434], length 2373
1532456862.023566 IP (tos 0x0, ttl 64, id 41365, offset 0, flags [DF], proto TCP (6), length 53)
    172.17.0.2.8000 > 172.17.0.1.37436: Flags [P.], cksum 0x584d (incorrect -> 0x428e), seq 1138318193:1138318194, ack 1274675995, win 235, options [nop,nop,TS val 2137468 ecr 2137468], length 1
1532456862.023931 IP (tos 0x0, ttl 64, id 41366, offset 0, flags [DF], proto TCP (6), length 426)
    172.17.0.2.8000 > 172.17.0.1.37436: Flags [P.], cksum 0x59c2 (incorrect -> 0xfed6), seq 1138318194:1138318568, ack 1274675995, win 235, options [nop,nop,TS val 2137468 ecr 2137468], length 374
1532456862.363212 IP (tos 0x0, ttl 64, id 41367, offset 0, flags [DF], proto TCP (6), length 2439)
    172.17.0.2.8000 > 172.17.0.1.37436: Flags [P.], cksum 0x619f (incorrect -> 0x5ea2), seq 1138318568:1138320955, ack 1274675995, win 235, options [nop,nop,TS val 2137502 ecr 2137468], length 2387
1532456862.363344 IP (tos 0x0, ttl 64, id 15307, offset 0, flags [DF], proto TCP (6), length 2439)
    172.17.0.2.8000 > 172.17.0.1.36866: Flags [P.], cksum 0x619f (incorrect -> 0x2627), seq 2719221314:2719223701, ack 3983119563, win 235, options [nop,nop,TS val 2137502 ecr 2137468], length 2387
1532456862.704581 IP (tos 0x0, ttl 64, id 41369, offset 0, flags [DF], proto TCP (6), length 2439)
    172.17.0.2.8000 > 172.17.0.1.37436: Flags [P.], cksum 0x619f (incorrect -> 0x2038), seq 1138320955:1138323342, ack 1274675995, win 235, options [nop,nop,TS val 2137536 ecr 2137502], length 2387
1532456862.704800 IP (tos 0x0, ttl 64, id 15309, offset 0, flags [DF], proto TCP (6), length 2439)
    172.17.0.2.8000 > 172.17.0.1.36866: Flags [P.], cksum 0x619f (incorrect -> 0xe7bc), seq 2719223701:2719226088, ack 3983119563, win 235, options [nop,nop,TS val 2137536 ecr 2137502], length 2387
1532456863.043392 IP (tos 0x0, ttl 64, id 41371, offset 0, flags [DF], proto TCP (6), length 2425)
    172.17.0.2.8000 > 172.17.0.1.37436: Flags [P.], cksum 0x6191 (incorrect -> 0xa8c8), seq 1138323342:1138325715, ack 1274675995, win 235, options [nop,nop,TS val 2137570 ecr 2137536], length 2373
1532456863.043605 IP (tos 0x0, ttl 64, id 15311, offset 0, flags [DF], proto TCP (6), length 2425)
    172.17.0.2.8000 > 172.17.0.1.36866: Flags [P.], cksum 0x6191 (incorrect -> 0x704d), seq 2719226088:2719228461, ack 3983119563, win 235, options [nop,nop,TS val 2137570 ecr 2137536], length 2373
1532456863.382550 IP (tos 0x0, ttl 64, id 41373, offset 0, flags [DF], proto TCP (6), length 723)
    172.17.0.2.8000 > 172.17.0.1.37436: Flags [P.], cksum 0x5aeb (incorrect -> 0x1cfc), seq 1138325715:1138326386, ack 1274675995, win 235, options [nop,nop,TS val 2137604 ecr 2137570], length 671
1532456863.382717 IP (tos 0x0, ttl 64, id 15313, offset 0, flags [DF], proto TCP (6), length 2425)
    172.17.0.2.8000 > 172.17.0.1.36866: Flags [P.], cksum 0x6191 (incorrect -> 0xfa39), seq 2719228461:2719230834, ack 3983119563, win 235, options [nop,nop,TS val 2137604 ecr 2137570], length 2373
1532456863.383259 IP (tos 0x0, ttl 64, id 41374, offset 0, flags [DF], proto TCP (6), length 53)
    172.17.0.2.8000 > 172.17.0.1.37436: Flags [P.], cksum 0x584d (incorrect -> 0x217d), seq 1138326386:1138326387, ack 1274675995, win 235, options [nop,nop,TS val 2137604 ecr 2137604], length 1
1532456863.383642 IP (tos 0x0, ttl 64, id 41375, offset 0, flags [DF], proto TCP (6), length 1754)
    172.17.0.2.8000 > 172.17.0.1.37436: Flags [P.], cksum 0x5ef2 (incorrect -> 0x79f3), seq 1138326387:1138328089, ack 1274675995, win 235, options [nop,nop,TS val 2137604 ecr 2137604], length 1702
1532456863.722074 IP (tos 0x0, ttl 64, id 41377, offset 0, flags [DF], proto TCP (6), length 2425)
    172.17.0.2.8000 > 172.17.0.1.37436: Flags [P.], cksum 0x6191 (incorrect -> 0x9e58), seq 1138328089:1138330462, ack 1274675995, win 235, options [nop,nop,TS val 2137638 ecr 2137604], length 2373
1532456863.722244 IP (tos 0x0, ttl 64, id 15315, offset 0, flags [DF], proto TCP (6), length 2425)
    172.17.0.2.8000 > 172.17.0.1.36866: Flags [P.], cksum 0x6191 (incorrect -> 0x65de), seq 2719230834:2719233207, ack 3983119563, win 235, options [nop,nop,TS val 2137638 ecr 2137604], length 2373
1532456864.061655 IP (tos 0x0, ttl 64, id 41379, offset 0, flags [DF], proto TCP (6), length 2432)
    172.17.0.2.8000 > 172.17.0.1.37436: Flags [P.], cksum 0x6198 (incorrect -> 0x1d2f), seq 1138330462:1138332842, ack 1274675995, win 235, options [nop,nop,TS val 2137672 ecr 2137638], length 2380
1532456864.061885 IP (tos 0x0, ttl 64, id 15317, offset 0, flags [DF], proto TCP (6), length 2432)
    172.17.0.2.8000 > 172.17.0.1.36866: Flags [P.], cksum 0x6198 (incorrect -> 0xe4b4), seq 2719233207:2719235587, ack 3983119563, win 235, options [nop,nop,TS val 2137672 ecr 2137638], length 2380
1532456864.402007 IP (tos 0x0, ttl 64, id 41381, offset 0, flags [DF], proto TCP (6), length 1789)
    172.17.0.2.8000 > 172.17.0.1.37436: Flags [P.], cksum 0x5f15 (incorrect -> 0x3337), seq 1138332842:1138334579, ack 1274675995, win 235, options [nop,nop,TS val 2137706 ecr 2137672], length 1737
1532456864.402350 IP (tos 0x0, ttl 64, id 15319, offset 0, flags [DF], proto TCP (6), length 2432)
    172.17.0.2.8000 > 172.17.0.1.36866: Flags [P.], cksum 0x6198 (incorrect -> 0x3848), seq 2719235587:2719237967, ack 3983119563, win 235, options [nop,nop,TS val 2137706 ecr 2137672], length 2380
1532456864.402812 IP (tos 0x0, ttl 64, id 41383, offset 0, flags [DF], proto TCP (6), length 53)
    172.17.0.2.8000 > 172.17.0.1.37436: Flags [P.], cksum 0x584d (incorrect -> 0x00b0), seq 1138334579:1138334580, ack 1274675995, win 235, options [nop,nop,TS val 2137706 ecr 2137706], length 1
1532456864.403034 IP (tos 0x0, ttl 64, id 41384, offset 0, flags [DF], proto TCP (6), length 695)
    172.17.0.2.8000 > 172.17.0.1.37436: Flags [P.], cksum 0x5acf (incorrect -> 0x0c6d), seq 1138334580:1138335223, ack 1274675995, win 235, options [nop,nop,TS val 2137706 ecr 2137706], length 643
1532456864.742777 IP (tos 0x0, ttl 64, id 41385, offset 0, flags [DF], proto TCP (6), length 2439)
    172.17.0.2.8000 > 172.17.0.1.37436: Flags [P.], cksum 0x619f (incorrect -> 0x88dd), seq 1138335223:1138337610, ack 1274675995, win 235, options [nop,nop,TS val 2137740 ecr 2137706], length 2387
1532456864.743085 IP (tos 0x0, ttl 64, id 15321, offset 0, flags [DF], proto TCP (6), length 2439)
    172.17.0.2.8000 > 172.17.0.1.36866: Flags [P.], cksum 0x619f (incorrect -> 0x5064), seq 2719237967:2719240354, ack 3983119563, win 235, options [nop,nop,TS val 2137740 ecr 2137706], length 2387
1532456865.079610 IP (tos 0x0, ttl 64, id 41387, offset 0, flags [DF], proto TCP (6), length 2411)
    172.17.0.2.8000 > 172.17.0.1.37436: Flags [P.], cksum 0x6183 (incorrect -> 0x4654), seq 1138337610:1138339969, ack 1274675995, win 235, options [nop,nop,TS val 2137774 ecr 2137740], length 2359
1532456865.079780 IP (tos 0x0, ttl 64, id 15323, offset 0, flags [DF], proto TCP (6), length 2411)
    172.17.0.2.8000 > 172.17.0.1.36866: Flags [P.], cksum 0x6183 (incorrect -> 0x0ddb), seq 2719240354:2719242713, ack 3983119563, win 235, options [nop,nop,TS val 2137774 ecr 2137740], length 2359
1532456865.420358 IP (tos 0x0, ttl 64, id 41389, offset 0, flags [DF], proto TCP (6), length 2439)
    172.17.0.2.8000 > 172.17.0.1.37436: Flags [P.], cksum 0x619f (incorrect -> 0x7bde), seq 1138339969:1138342356, ack 1274675995, win 235, options [nop,nop,TS val 2137808 ecr 2137774], length 2387
1532456865.420690 IP (tos 0x0, ttl 64, id 15325, offset 0, flags [DF], proto TCP (6), length 2439)
    172.17.0.2.8000 > 172.17.0.1.36866: Flags [P.], cksum 0x619f (incorrect -> 0x4365), seq 2719242713:2719245100, ack 3983119563, win 235, options [nop,nop,TS val 2137808 ecr 2137774], length 2387
1532456865.759994 IP (tos 0x0, ttl 64, id 41391, offset 0, flags [DF], proto TCP (6), length 468)
    172.17.0.2.8000 > 172.17.0.1.37436: Flags [P.], cksum 0x59ec (incorrect -> 0x19e0), seq 1138342356:1138342772, ack 1274675995, win 235, options [nop,nop,TS val 2137842 ecr 2137808], length 416
1532456865.760195 IP (tos 0x0, ttl 64, id 15327, offset 0, flags [DF], proto TCP (6), length 2425)
    172.17.0.2.8000 > 172.17.0.1.36866: Flags [P.], cksum 0x6191 (incorrect -> 0x25db), seq 2719245100:2719247473, ack 3983119563, win 235, options [nop,nop,TS val 2137842 ecr 2137808], length 2373
1532456865.760463 IP (tos 0x0, ttl 64, id 41392, offset 0, flags [DF], proto TCP (6), length 53)
    172.17.0.2.8000 > 172.17.0.1.37436: Flags [P.], cksum 0x584d (incorrect -> 0xdf9e), seq 1138342772:1138342773, ack 1274675995, win 235, options [nop,nop,TS val 2137842 ecr 2137842], length 1
1532456865.760949 IP (tos 0x0, ttl 64, id 41393, offset 0, flags [DF], proto TCP (6), length 2009)
    172.17.0.2.8000 > 172.17.0.1.37436: Flags [P.], cksum 0x5ff1 (incorrect -> 0x2413), seq 1138342773:1138344730, ack 1274675995, win 235, options [nop,nop,TS val 2137842 ecr 2137842], length 1957
1532456866.099684 IP (tos 0x0, ttl 64, id 41395, offset 0, flags [DF], proto TCP (6), length 2432)
    172.17.0.2.8000 > 172.17.0.1.37436: Flags [P.], cksum 0x6198 (incorrect -> 0x52ca), seq 1138344730:1138347110, ack 1274675995, win 235, options [nop,nop,TS val 2137876 ecr 2137842], length 2380
1532456866.099832 IP (tos 0x0, ttl 64, id 15329, offset 0, flags [DF], proto TCP (6), length 2432)
    172.17.0.2.8000 > 172.17.0.1.36866: Flags [P.], cksum 0x6198 (incorrect -> 0x1a52), seq 2719247473:2719249853, ack 3983119563, win 235, options [nop,nop,TS val 2137876 ecr 2137842], length 2380
1532456866.438345 IP (tos 0x0, ttl 64, id 41397, offset 0, flags [DF], proto TCP (6), length 2425)
    172.17.0.2.8000 > 172.17.0.1.37436: Flags [P.], cksum 0x6191 (incorrect -> 0x4a95), seq 1138347110:1138349483, ack 1274675995, win 235, options [nop,nop,TS val 2137909 ecr 2137876], length 2373
1532456866.438474 IP (tos 0x0, ttl 64, id 15331, offset 0, flags [DF], proto TCP (6), length 2425)
    172.17.0.2.8000 > 172.17.0.1.36866: Flags [P.], cksum 0x6191 (incorrect -> 0x121d), seq 2719249853:2719252226, ack 3983119563, win 235, options [nop,nop,TS val 2137909 ecr 2137876], length 2373
1532456866.776590 IP (tos 0x0, ttl 64, id 41399, offset 0, flags [DF], proto TCP (6), length 1534)
    172.17.0.2.8000 > 172.17.0.1.37436: Flags [P.], cksum 0x5e16 (incorrect -> 0xc9c0), seq 1138349483:1138350965, ack 1274675995, win 235, options [nop,nop,TS val 2137943 ecr 2137909], length 1482
1532456866.776744 IP (tos 0x0, ttl 64, id 15333, offset 0, flags [DF], proto TCP (6), length 2418)
    172.17.0.2.8000 > 172.17.0.1.36866: Flags [P.], cksum 0x618a (incorrect -> 0x9198), seq 2719252226:2719254592, ack 3983119563, win 235, options [nop,nop,TS val 2137943 ecr 2137909], length 2366
1532456866.777064 IP (tos 0x0, ttl 64, id 41401, offset 0, flags [DF], proto TCP (6), length 53)
    172.17.0.2.8000 > 172.17.0.1.37436: Flags [P.], cksum 0x584d (incorrect -> 0xbed3), seq 1138350965:1138350966, ack 1274675995, win 235, options [nop,nop,TS val 2137943 ecr 2137943], length 1
1532456866.777434 IP (tos 0x0, ttl 64, id 41402, offset 0, flags [DF], proto TCP (6), length 936)
