tcpdump -i eth0 -nnS

Output:

11:31:20.182771 IP 172.17.0.1.50168 > 172.17.0.2.8000: Flags [.], ack 293878684, win 1431, options [nop,nop,TS val 3683779960 ecr 3466473379], length 0
11:31:20.525751 IP 172.17.0.2.8000 > 172.17.0.1.50168: Flags [P.], seq 293878684:293884172, ack 4221959844, win 235, options [nop,nop,TS val 3466473722 ecr 3683779960], length 5488
11:31:20.525817 IP 172.17.0.1.50168 > 172.17.0.2.8000: Flags [.], ack 293884172, win 1431, options [nop,nop,TS val 3683780303 ecr 3466473722], length 0
11:31:20.869293 IP 172.17.0.2.8000 > 172.17.0.1.50168: Flags [P.], seq 293884172:293889660, ack 4221959844, win 235, options [nop,nop,TS val 3466474065 ecr 3683780303], length 5488

####################################

tcpdump -nnS "tcp[13] & 8 != 0"

11:41:24.563928 IP 172.17.0.2.8000 > 172.17.0.1.50168: Flags [P.], seq 303543292:303548780, ack 4221959844, win 235, options [nop,nop,TS val 3467077761 ecr 3684383999], length 5488
11:41:24.907234 IP 172.17.0.2.8000 > 172.17.0.1.50168: Flags [P.], seq 303548780:303554284, ack 4221959844, win 235, options [nop,nop,TS val 3467078104 ecr 3684384342], length 5504
11:41:25.250303 IP 172.17.0.2.8000 > 172.17.0.1.50168: Flags [P.], seq 303554284:303559772, ack 4221959844, win 235, options [nop,nop,TS val 3467078447 ecr 3684384685], length 5488
11:41:25.593542 IP 172.17.0.2.8000 > 172.17.0.1.50168: Flags [P.], seq 303559772:303565260, ack 4221959844, win 235, options [nop,nop,TS val 3467078790 ecr 3684385028], length 5488
